{
  "mission_id": "MISSION-FIXTURE",
  "command_id": "MISSION-FIXTURE-T01",
  "parent_command_id": "MISSION-FIXTURE-C01",
  "parent_agent_id": "glm-general-commander",
  "child_agent_id": "content-specialist",
  "owner_agent_id": "content-specialist",
  "rank": 2,
  "role": "specialist_commander",
  "mission": "引用付きコンテンツ計画を安全に設計する",
  "objective": "業種テンプレートの下書きを作り、根拠を参照IDで報告する",
  "constraints": ["YouTube投稿はしない", "秘密値を扱わない"],
  "inputs": {"industry": "small-business"},
  "input_refs": ["artifact-research-fixture"],
  "expected_output": {"schema": "report-envelope-v1"},
  "deadline": null,
  "token_budget": 500,
  "time_budget_ms": 15000,
  "tool_scope": ["artifact_read", "artifact_write", "trace"],
  "may_spawn_children": true,
  "allowed_child_roles": ["worker"],
  "depends_on": [],
  "parallel_group": "content-design",
  "priority": 10,
  "depth": 2,
  "max_depth": 4,
  "done_when": ["report schema valid", "根拠参照を含む"],
  "permissions": ["draft", "report"],
  "idempotency_key": "MISSION-FIXTURE-T01",
  "created_at": "2026-09-08T00:00:00Z",
  "status": "queued"
}

